[{"id":"io.github.example.tyme","name":"Tyme","kinds":["bar-widget","panel"],"enabled":false,"active":false,"canDisable":true,"firstParty":false,"clonedFrom":""},{"id":"io.github.example.weather-plus","name":"Weather Plus","kinds":["bar-widget"],"enabled":true,"active":false,"canDisable":true,"firstParty":false,"clonedFrom":""},{"id":"omarchy.active-window","name":"Active window","kinds":["bar-widget"],"enabled":false,"active":false,"canDisable":true,"firstParty":true,"clonedFrom":""},{"id":"omarchy.agents","name":"Agents","kinds":["bar-widget"],"enabled":true,"active":false,"canDisable":true,"firstParty":true,"clonedFrom":""},{"id":"omarchy.audio","name":"Audio","kinds":["bar-widget"],"enabled":true,"active":false,"canDisable":true,"firstParty":true,"clonedFrom":""},{"id":"omarchy.background","name":"Background","kinds":["service"],"enabled":true,"active":false,"canDisable":true,"firstParty":true,"clonedFrom":""},{"id":"omarchy.bar","name":"Bar","kinds":["bar"],"enabled":true,"active":true,"canDisable":false,"firstParty":true,"clonedFrom":""},{"id":"omarchy.battery","name":"Battery","kinds":["service"],"enabled":true,"active":false,"canDisable":true,"firstParty":true,"clonedFrom":""},{"id":"omarchy.bluetooth","name":"Bluetooth","kinds":["bar-widget"],"enabled":true,"active":false,"canDisable":true,"firstParty":true,"clonedFrom":""},{"id":"omarchy.clipboard","name":"Clipboard","kinds":["overlay"],"enabled":true,"active":false,"canDisable":true,"firstParty":true,"clonedFrom":""},{"id":"omarchy.clock","name":"Clock","kinds":["bar-widget"],"enabled":false,"active":false,"canDisable":true,"firstParty":true,"clonedFrom":""},{"id":"omarchy.dev-gallery","name":"Dev gallery","kinds":["panel"],"enabled":true,"active":false,"canDisable":true,"firstParty":true,"clonedFrom":""},{"id":"omarchy.disk-speedtest","name":"Disk speed test","kinds":["panel"],"enabled":true,"active":false,"canDisable":true,"firstParty":true,"clonedFrom":""},{"id":"omarchy.dropbox","name":"Dropbox","kinds":["bar-widget"],"enabled":false,"active":false,"canDisable":true,"firstParty":true,"clonedFrom":""},{"id":"omarchy.emojis","name":"Emojis","kinds":["overlay"],"enabled":true,"active":false,"canDisable":true,"firstParty":true,"clonedFrom":""},{"id":"omarchy.idle","name":"Idle","kinds":["service"],"enabled":true,"active":false,"canDisable":true,"firstParty":true,"clonedFrom":""},{"id":"omarchy.image-picker","name":"Image picker","kinds":["overlay"],"enabled":true,"active":false,"canDisable":true,"firstParty":true,"clonedFrom":""},{"id":"omarchy.indicators","name":"Indicators","kinds":["bar-widget"],"enabled":true,"active":false,"canDisable":true,"firstParty":true,"clonedFrom":""},{"id":"omarchy.keyboard-layout","name":"Keyboard layout","kinds":["bar-widget"],"enabled":true,"active":false,"canDisable":true,"firstParty":true,"clonedFrom":""},{"id":"omarchy.lock","name":"Lock Screen","kinds":["service"],"enabled":true,"active":false,"canDisable":true,"firstParty":true,"clonedFrom":""},{"id":"omarchy.media","name":"Media","kinds":["service","bar-widget"],"enabled":false,"active":false,"canDisable":true,"firstParty":true,"clonedFrom":""},{"id":"omarchy.menu","name":"Omarchy menu","kinds":["menu","bar-widget"],"enabled":true,"active":false,"canDisable":true,"firstParty":true,"clonedFrom":""},{"id":"omarchy.microphone","name":"Microphone","kinds":["bar-widget"],"enabled":false,"active":false,"canDisable":true,"firstParty":true,"clonedFrom":""},{"id":"omarchy.monitor","name":"Display","kinds":["bar-widget"],"enabled":true,"active":false,"canDisable":true,"firstParty":true,"clonedFrom":""},{"id":"omarchy.network","name":"Network","kinds":["bar-widget"],"enabled":true,"active":false,"canDisable":true,"firstParty":true,"clonedFrom":""},{"id":"omarchy.nightlight","name":"Night Light","kinds":["service"],"enabled":true,"active":false,"canDisable":true,"firstParty":true,"clonedFrom":""},{"id":"omarchy.notifications","name":"Notifications","kinds":["service"],"enabled":true,"active":false,"canDisable":true,"firstParty":true,"clonedFrom":""},{"id":"omarchy.osd","name":"On-screen display","kinds":["panel"],"enabled":true,"active":false,"canDisable":true,"firstParty":true,"clonedFrom":""},{"id":"omarchy.polkit","name":"Polkit Agent","kinds":["service"],"enabled":true,"active":false,"canDisable":true,"firstParty":true,"clonedFrom":""},{"id":"omarchy.power","name":"Power","kinds":["bar-widget"],"enabled":true,"active":false,"canDisable":true,"firstParty":true,"clonedFrom":""},{"id":"omarchy.reminders","name":"Reminders","kinds":["overlay"],"enabled":true,"active":false,"canDisable":true,"firstParty":true,"clonedFrom":""},{"id":"omarchy.spacer","name":"Spacer","kinds":["bar-widget"],"enabled":false,"active":false,"canDisable":true,"firstParty":true,"clonedFrom":""},{"id":"omarchy.speedtest","name":"Speed Test","kinds":["panel"],"enabled":true,"active":false,"canDisable":true,"firstParty":true,"clonedFrom":""},{"id":"omarchy.system-update","name":"Omarchy update","kinds":["bar-widget"],"enabled":true,"active":false,"canDisable":true,"firstParty":true,"clonedFrom":""},{"id":"omarchy.tailscale","name":"Tailscale","kinds":["bar-widget"],"enabled":true,"active":false,"canDisable":true,"firstParty":true,"clonedFrom":""},{"id":"omarchy.tray","name":"System tray","kinds":["bar-widget"],"enabled":true,"active":false,"canDisable":true,"firstParty":true,"clonedFrom":""},{"id":"omarchy.weather","name":"Weather","kinds":["bar-widget"],"enabled":true,"active":false,"canDisable":true,"firstParty":true,"clonedFrom":""},{"id":"omarchy.wifiqr","name":"Wi-Fi QR","kinds":["panel"],"enabled":true,"active":false,"canDisable":true,"firstParty":true,"clonedFrom":""},{"id":"omarchy.workspaces","name":"Workspaces","kinds":["bar-widget"],"enabled":true,"active":false,"canDisable":true,"firstParty":true,"clonedFrom":""},{"id":"user.clock","name":"Clock","kinds":["bar-widget"],"enabled":true,"active":false,"canDisable":true,"firstParty":false,"clonedFrom":"omarchy.clock"}]
